{
  "$schema": "./selections.schema.json",
  "schemaVersion": "1.0",
  "nombre": "full",
  "descripcion": "Todo lo catalogado que sea compatible con la edicion de Windows elegida.",
  "comoEditar": "Anade o quita 'id' exactos de ../catalog.json. Puedes crear apps/selections/local.json (ignorado por git) con el mismo formato para no tocar los ficheros del repositorio.",
  "aplicaciones": [
    {
      "id": "7zip.7zip"
    },
    {
      "id": "Microsoft.WindowsTerminal"
    },
    {
      "id": "VideoLAN.VLC"
    },
    {
      "id": "Microsoft.VisualStudioCode"
    },
    {
      "id": "Google.Chrome"
    },
    {
      "id": "Mozilla.Firefox"
    },
    {
      "id": "Brave.Brave"
    },
    {
      "id": "Microsoft.PowerToys"
    },
    {
      "id": "Notepad++.Notepad++"
    },
    {
      "id": "ShareX.ShareX"
    },
    {
      "id": "TechPowerUp.GPU-Z"
    },
    {
      "id": "CPUID.CPU-Z"
    },
    {
      "id": "CPUID.HWMonitor"
    },
    {
      "id": "CPUID.powerMAX"
    },
    {
      "id": "Geeks3D.FurMark"
    },
    {
      "id": "MSI.Kombustor"
    },
    {
      "id": "TechPowerUp.NVCleanstall"
    },
    {
      "id": "TechPowerUp.ThrottleStop"
    },
    {
      "id": "Valve.Steam"
    },
    {
      "id": "EpicGames.EpicGamesLauncher"
    },
    {
      "id": "Mojang.MinecraftLauncher"
    },
    {
      "id": "Discord.Discord"
    },
    {
      "id": "OBSProject.OBSStudio"
    },
    {
      "id": "LizardByte.Sunshine"
    },
    {
      "id": "AntiMicroX.antimicrox"
    },
    {
      "id": "Tailscale.Tailscale"
    },
    {
      "id": "WireGuard.WireGuard"
    },
    {
      "id": "Greenshot.Greenshot"
    },
    {
      "id": "Microsoft.Edge"
    },
    {
      "id": "EclipseAdoptium.Temurin.21.JRE"
    }
  ]
}
