{
  "$schema": "./selections.schema.json",
  "schemaVersion": "1.0",
  "nombre": "minimal",
  "descripcion": "Solo lo minimo para que el escritorio sea usable (compresion + terminal).",
  "comoEditar": "Anade o quita 'id' exactos de ../catalog.json. Puedes crear apps/selections/local.json (ignorado por git) con el mismo formato para no tocar los ficheros del repositorio.",
  "aplicaciones": [
    {
      "id": "7zip.7zip"
    },
    {
      "id": "Microsoft.WindowsTerminal"
    }
  ]
}
