{
  "$schema": "./selections.schema.json",
  "schemaVersion": "1.0",
  "nombre": "gaming",
  "descripcion": "Launchers, cliente de voz y el canal de juego (Sunshine) + mapeo de mandos.",
  "comoEditar": "Anade o quita 'id' exactos de ../catalog.json. Puedes crear apps/selections/local.json (ignorado por git) con el mismo formato para no tocar los ficheros del repositorio.",
  "aplicaciones": [
    {
      "id": "7zip.7zip"
    },
    {
      "id": "VideoLAN.VLC"
    },
    {
      "id": "Google.Chrome"
    },
    {
      "id": "Microsoft.PowerToys"
    },
    {
      "id": "ShareX.ShareX"
    },
    {
      "id": "TechPowerUp.GPU-Z"
    },
    {
      "id": "CPUID.HWMonitor"
    },
    {
      "id": "Geeks3D.FurMark"
    },
    {
      "id": "Valve.Steam"
    },
    {
      "id": "EpicGames.EpicGamesLauncher"
    },
    {
      "id": "Mojang.MinecraftLauncher"
    },
    {
      "id": "Discord.Discord"
    },
    {
      "id": "LizardByte.Sunshine"
    },
    {
      "id": "AntiMicroX.antimicrox"
    },
    {
      "id": "Tailscale.Tailscale"
    }
  ]
}
